Use dictionnary file METRIX.dic
Attention: Le quadripole SSME1L61SSMEL_Td a une admittance tres grande (715.9455871582)
Attention: Le quadripole DEPH1L71MUHLB_Td a une admittance tres grande (1444.0116882324)
Informations générales sur le réseau :
Demi-bande de réglage globale = 0.000000
Demi-bande de réglage ignorée car il n'y a pas de défauts groupes
Puissance maximale perdue sur un incident =          0 MW
Nombre d'incidents valides = 0 (sur 0)
Nombre de regions       = 10
Nombre total de noeuds  = 7130
Nombre de consommations = 7836 (dont 0 peuvent agir en curatif)
Nombre de quadripoles   = 10032 (dont 0 surveillés en N et 0 surveillés sur défaut)
Nombre de groupes       = 9510 (dont 0 peuvent agir en curatif)
Nombre de transfo. dephaseurs = 43 (dont 0 peuvent agir en curatif)
Nombre de liaisons à courant continu = 10 (dont 0 peuvent agir en curatif et 0 fonctionnent en émulation AC)
Coefficient de perte = 0.00%
Pas de limitation du nombre d'actions curatives sur incident
Nombre de composantes synchrones 2
Pénalisation des TD dans la fonction coût   = 0.01
Pénalisation des HVDC dans la fonction coût = 0.1

Pour le td 'CHATEY761' la prise souhaitée -1 est introuvable pour la variante 3
Pour le td 'INNERY761' la prise souhaitée -1 est introuvable pour la variante 3
Pour le td 'ARGI2L61ARGIA' la prise souhaitée -1 est introuvable pour la variante 3
Pour le td 'CHATEY761' la prise souhaitée 25 est introuvable pour la variante 4
Pour le td 'INNERY761' la prise souhaitée 31 est introuvable pour la variante 4
Pour le td 'ARGI2L61ARGIA' la prise souhaitée 33 est introuvable pour la variante 4
Lancement de METRIX sans curatif topologique
Mode de calcul : OPF
Noeud bilan : 0
0(2) <-> 300 [.MTTO 6 .MARI 1, .MTTO 6 .MARI 2, .MTTO 6 TR 638 C, .MTTO 6 TR 651 C, .MTTO 6 TR 652 C, .MTTO 6 TR 653 C, .MTTO 6 TR 654 C](4) <-> 83(2)
                                                                                                                                             <-> 146 [.ENTR 6 TR 611 C, .ENTR 6 TR 612 C, .ENTR 6 TR 613 C, .ENTR 6 TR 644 C, .ENTR 6 TR 645 C](2)
                                                                                                                                             <-> 151 [.ESPA 6 TR 643 C, .ESPA 6 TR 645 C, .ESPA 6 TR 646 C](2)
     <-> 326 [.PENA 6 TR654 1](5) <-> 83(2)
                                  <-> 474 [.VILN 6 TR 651 C, .VILN 6 TR 652 C, .VILN 6 TR 653 C](3)
                                  <-> 327(4)

Noeud bilan : 58
58(1) <-> 446 [CONSO.UK](6) <-> 66(1)
                            <-> 88(1)
                            <-> 157(1)
                            <-> 211(1)
                            <-> 306(1)
      |=| 3853(6) <-> 515(13)
                  <-> 1120(4)
                  <-> 2897(3)
                  <-> 6263(8)
                  <-> 3851(2)
                  <-> 3852(5)


********************************************
Traitement d'un paquet de 5 variante(s)
********************************************

---------------------
---------------------
Variante numéro 0
---------------------
---------------------

le TD ARGI2L61ARGIA est limite a la hausse
le TD ARGI2L61ARGIA est limite a la baisse
le TD CHATEY761 est limite a la hausse
le TD INNERY761 est limite a la baisse
Demarrage des groupes par empilement économique :
Consommation globale                = 231425.0054  MW
Production démarrée                 = 236389.7571  MW
Puissance à ajuster                 = -4964.7517  MW
Puissance disponible à la hausse (hors Pimp) = 1490683.3903  MW
Puissance disponible à la baisse (hors Pimp) = -252815.4571  MW
Bilans par zones synchrones :
Zone synchrone 0 (noeud bilan 0), bilan = -0.2483 MW
Zone synchrone 1 (noeud bilan 58), bilan = 4965.0000 MW

Utilisation du simplexe car une Pmin est différente de zéro
Appel du simplexe
Solution optimale trouvée pour la variante 0 (code retour = 1)
Résultats en volume (MW)
Volume de production =  231425.0054 MW
Volume de délestage  =       0.0000 MW
Résultats sur les couts
Cout associé aux groupes       :       0.0000
Cout associé au délestage      :       0.0000
Cout de pénalisation TD & HVDC :       0.0000
Cout des écarts de transit     :       0.0000
Valeur de la fonction objectif :       0.0000

Prise en compte des couts avec reseau
Micro itération 1 (nombre de contraintes 2)
-------------------- : 

Des contraintes ont été détectées : 0
Nb termes dans la matrice : 26873 (taille de la matrice : 26873)
Pas de contraintes

---------------------
---------------------
Variante numéro 1
---------------------
---------------------

le TD ARGI2L61ARGIA est limite a la hausse
le TD CHATEY761 est limite a la hausse
Demarrage des groupes par empilement économique :
Consommation globale                = 231425.0054  MW
Production démarrée                 = 236389.7571  MW
Puissance à ajuster                 = -4964.7517  MW
Puissance disponible à la hausse (hors Pimp) = 1490683.3903  MW
Puissance disponible à la baisse (hors Pimp) = -252815.4571  MW
Bilans par zones synchrones :
Zone synchrone 0 (noeud bilan 0), bilan = -0.2483 MW
Zone synchrone 1 (noeud bilan 58), bilan = 4965.0000 MW

Utilisation du simplexe car une Pmin est différente de zéro
Appel du simplexe
Solution optimale trouvée pour la variante 1 (code retour = 1)
Résultats en volume (MW)
Volume de production =  231425.0054 MW
Volume de délestage  =       0.0000 MW
Résultats sur les couts
Cout associé aux groupes       :       0.0000
Cout associé au délestage      :       0.0000
Cout de pénalisation TD & HVDC :       0.0000
Cout des écarts de transit     :       0.0000
Valeur de la fonction objectif :       0.0000

Prise en compte des couts avec reseau
Micro itération 1 (nombre de contraintes 2)
-------------------- : 

Des contraintes ont été détectées : 0
Nb termes dans la matrice : 26873 (taille de la matrice : 26873)
Pas de contraintes

---------------------
---------------------
Variante numéro 2
---------------------
---------------------

le TD ARGI2L61ARGIA est limite a la baisse
le TD INNERY761 est limite a la baisse
Demarrage des groupes par empilement économique :
Consommation globale                = 231425.0054  MW
Production démarrée                 = 236389.7571  MW
Puissance à ajuster                 = -4964.7517  MW
Puissance disponible à la hausse (hors Pimp) = 1490683.3903  MW
Puissance disponible à la baisse (hors Pimp) = -252815.4571  MW
Bilans par zones synchrones :
Zone synchrone 0 (noeud bilan 0), bilan = -0.2483 MW
Zone synchrone 1 (noeud bilan 58), bilan = 4965.0000 MW

Utilisation du simplexe car une Pmin est différente de zéro
Appel du simplexe
Solution optimale trouvée pour la variante 2 (code retour = 1)
Résultats en volume (MW)
Volume de production =  231425.0054 MW
Volume de délestage  =       0.0000 MW
Résultats sur les couts
Cout associé aux groupes       :       0.0000
Cout associé au délestage      :       0.0000
Cout de pénalisation TD & HVDC :       0.0000
Cout des écarts de transit     :       0.0000
Valeur de la fonction objectif :       0.0000

Prise en compte des couts avec reseau
Micro itération 1 (nombre de contraintes 2)
-------------------- : 

Des contraintes ont été détectées : 0
Nb termes dans la matrice : 26873 (taille de la matrice : 26873)
Pas de contraintes

---------------------
---------------------
Variante numéro 3
---------------------
---------------------

le TD ARGI2L61ARGIA est limite a la hausse
le TD ARGI2L61ARGIA est limite a la baisse
le TD CHATEY761 est limite a la hausse
le TD INNERY761 est limite a la baisse
Demarrage des groupes par empilement économique :
Consommation globale                = 231425.0054  MW
Production démarrée                 = 236389.7571  MW
Puissance à ajuster                 = -4964.7517  MW
Puissance disponible à la hausse (hors Pimp) = 1490683.3903  MW
Puissance disponible à la baisse (hors Pimp) = -252815.4571  MW
Bilans par zones synchrones :
Zone synchrone 0 (noeud bilan 0), bilan = -0.2483 MW
Zone synchrone 1 (noeud bilan 58), bilan = 4965.0000 MW

Utilisation du simplexe car une Pmin est différente de zéro
Appel du simplexe
Solution optimale trouvée pour la variante 3 (code retour = 1)
Résultats en volume (MW)
Volume de production =  231425.0054 MW
Volume de délestage  =       0.0000 MW
Résultats sur les couts
Cout associé aux groupes       :       0.0000
Cout associé au délestage      :       0.0000
Cout de pénalisation TD & HVDC :       0.0000
Cout des écarts de transit     :       0.0000
Valeur de la fonction objectif :       0.0000

Prise en compte des couts avec reseau
Micro itération 1 (nombre de contraintes 2)
-------------------- : 

Des contraintes ont été détectées : 0
Nb termes dans la matrice : 26873 (taille de la matrice : 26873)
Pas de contraintes

---------------------
---------------------
Variante numéro 4
---------------------
---------------------

le TD ARGI2L61ARGIA est limite a la hausse
le TD ARGI2L61ARGIA est limite a la baisse
le TD CHATEY761 est limite a la hausse
le TD INNERY761 est limite a la baisse
Demarrage des groupes par empilement économique :
Consommation globale                = 231425.0054  MW
Production démarrée                 = 236389.7571  MW
Puissance à ajuster                 = -4964.7517  MW
Puissance disponible à la hausse (hors Pimp) = 1490683.3903  MW
Puissance disponible à la baisse (hors Pimp) = -252815.4571  MW
Bilans par zones synchrones :
Zone synchrone 0 (noeud bilan 0), bilan = -0.2483 MW
Zone synchrone 1 (noeud bilan 58), bilan = 4965.0000 MW

Utilisation du simplexe car une Pmin est différente de zéro
Appel du simplexe
Solution optimale trouvée pour la variante 4 (code retour = 1)
Résultats en volume (MW)
Volume de production =  231425.0054 MW
Volume de délestage  =       0.0000 MW
Résultats sur les couts
Cout associé aux groupes       :       0.0000
Cout associé au délestage      :       0.0000
Cout de pénalisation TD & HVDC :       0.0000
Cout des écarts de transit     :       0.0000
Valeur de la fonction objectif :       0.0000

Prise en compte des couts avec reseau
Micro itération 1 (nombre de contraintes 2)
-------------------- : 

Des contraintes ont été détectées : 0
Nb termes dans la matrice : 26873 (taille de la matrice : 26873)
Pas de contraintes
